,tweet,label
5013,ambition refuse quit leadership refuse quit others,0
6274,anxiety unless,0
8279,pattonoswalt stop talk comedy cereal badly write porn spam,0
8219,program alexa order pizza shout incoherently second,0
4739,relationshipgoals,0
4345,tbh scary back work hospital prepping coronavirus hide surgical mask cancel elective procedure limit visitor send nonessential staff home mandating quarantine scary part come next lt,0
619,always wear smile life full reason smile smile reason others smile,1
3220,level sadness wash away deep purer level sadness,1
3731,page snowcrash paperback version deserve frame,0
4124,love follow teslaisafraud crowd hate say think proven right end,0
735,thankful hard time struggle definitely make stronger,1
5332,give people reason come work place go work,0
4884,pokemon battle irl catch,0
4340,day selfdistancing gain lbs think happy ever body,0
223,okay okay,1
6870,lesson barely light dimly glow people attract represent demonstrate dark place fixmylife,0
1114,care need someone talk dm open want rant someone lot love,1
206,sorry trust issue give someone everything toss away like nothing something inside break,1
3928,man wrong people woman check airbnb find hidden camera disguise phone charger gross,0
5549,correction leader eat last launch event barnes amp noble broadway amp nd nyc tomorrow pm hope see,0
5463,challenge face scare u probably important,0
2343,reason make realize much relate fuck life,1
2808,everything get shittier yes,1
1936,head hurt,1
1836,need feel pain feel alive,1
3825,today tweet list cool people like follow three reaction nice thanks rec nice hey woman omg guy tweet list without woman get,0
986,past call let go voicemail nothing new say,1
2121,care,1
2705,selfesteem,1
499,smile want cry talk want quiet pretend like happy breaking,1
8091,one thing would predict greenland small population blockbuster video conangreenland,0
528,proud australia instead fear choose love support muslim brother sister illridewithyou sydneysiege mateship,1
1100,become someone look happy mean even white rise black shadow cmh,1
2001,ready throw away thing look forward even care,1
6788,criticism make smarter well one criticizing,0
5443,manager metric become leader people choosetolead,0
5360,must find purpose cause pursue otherwise leave imperfection focus,0
8173,commission local artist jasper paint poster show think nail conanghana,0
526,feel change even laugh anymore smile talk damn tire everything,1
4177,first mins pod jason balajis,0
4715,play jackbox party game bunch league nerd,0
1035,want see smile know mean ll leave,1
6041,hey guy true go start give chess lesson stream follow cover stonewall open importance snack high school crush edition every game lose shot tequila hmu interested,0
5800,best support get come love u tell u time,0
7100,god desire happy healthy love stop try convince god deserve,0
1283,everything go shit,1
8265,leastfavorite comeback time measles,0
635,suicide cowardly ll tell cowardly treat people badly want end life,1
661,mother always tell ca say anything nice say anything people wonder quiet around,1
6831,new improve audio content update available mind matter meditation soothe heal mind iyanla vanzant available io android iyanla iyanlavanzant iyanlameditations mindmattersmeditations iyanlafixmylife fearnot,0
5760,combine usairways americanairlines become large bad airline country,0
7295,subscribe today amp get new daily principle wake iyanla voice alarm feature awakeningsapp iyanla iyanlavanzant actsoffaith fixmylife iyanlaguidance spiritualguidance spiritualcoach dailyguidance awakening positivethinking,0
3923,medium predict landslide wrong people vote biden feel like vote closer rather expert wrong half country want vote trump,0
6285,worry guy love eachother,0
116,pain change people make trust less overthink shut people,1
1899,stop med really bad anxiety attack take,1
280,disappointed lot people year trust say one disappointed,1
1224,ca stop suicidal thought one day ll take,1
7750,young use learn new word find way awkwardly shoehorn conversation talk classic bildungsroman,0
740,worry ll perfectly fine cause way see thing loss mine,1
1366,ca longer,1
5088,never one learn book learn best listen amp ask question best idea come decide podcast wanted capture conversation want honest amp openeven little voyeuristic,0
2768,forgave forget,1
7030,nice today tell anyone love do,0
8044,movie pitch millenials buy house turn haunt grateful able afford something good school district,0
4015,crypto devs get something interesting,0
2278,really wan na cut,1
7828,well gang reach end netflix get ta say lilyhammer hold,0
7815,least flattened curve sharona parody,0
738,rather lose argument someone lose someone argument,1
6778,iyanla anti viral mssage,0
2082,idk stop nothing live,1
4040,gpt smart sushantkumar,0
2130,wake every hour two hour sick want sleep,1
1392,slowly push everyone away,1
3252,high loneliness,1
5413,chase dream competition,0
1993,ptsd kick as,1
3988,,0
6505,iyanla read may th passage louise hay trust life take iyanla daily anti viral message day originally air june,0
1040,wake hard thing,1
6468,iyanla read love amp law ernest holmes passage explain destroy error human consciousness replace negative positive take iyanla daily anti viral message originally air june,0
5929,rust server justaminx corinnakopf pokimanelol ninja jschlatt bellapoarch mayahiga berniesanders hasanthehun,0
1394,sleep escape sleep thought keep awake,1
3294,wish ignoring,1
6046,know might seem like much finally hit youtube ty,0
2413,cry be else new,1
6706,matter think know know life teach honor respect balance must discord order achieve harmony must darkness propels u light,0
7419,think billion dollar away host snl,0
1272,insomnia best friend,1
2396,sick living,1
7759,watch part move conversation senbooker empathy human dignity moral leadership,0
6898,every living godappointed guardian spirit walk life recognition praise thanksgiving guardian spirit strengthen presence influence life,0
1269,brain stop think heart please stop feeling,1
5470,matter much know matter clearly others understand know,0
6875,lesson hide true self true feeling true desire people fall love real show shock horrify response real fixmylife,0
3832,invest btc,0
6845,you invite step money forgiveness lynne twist ready to complete forgive past money mistake open new channel prosperity flow life click join free minute teaching,0
5767,rep goal deny obama victory dems goal hold senate majority either goal fixing problem,0
7041,legacy season intention share teach lesson last lifetime lesson distinction finish complete fixmylife,0
5591,movement exist people inspire move something take cause,0
1148,get really bad actually know people like parent fight al time dad hit mom really know big mess way everyone,1
3938,write launch podcast think bad case scenario would achieve instead downloads first month,0
3362,give fine,1
1846,need courage kill,1
4122,cool people get together internet make list nd order effect covid ht mrgaryfox,0
5676,good come decision decision make,0
3906,since nursery place buy plant,0
1388,slowly lose,1
6546,discipline way avoid struggle chaos confusion,0
2863,good me lie,1
3549,conor like bad impression original conor,0
7825,pleasure chat darcycarden thank say muscular neck,0
3996,spacs roll fund billionaire,0
5624,realist see obstacle path amp idealist see beauty distance would well serve travel together,0
4887,best part,0
2659,draw,1
3101,milf head,1
8098,greenland become beautiful woman always know could conangreenland,0
6780,goal life win play game love rule game strong desire win believe worthy win faith win long alive never believe game,0
5516,achieve chase dream instead competition,0
5498,effort connect young demographic take bathroom selfie hip,0
2832,alive seem weird,1
3766,case miss elon clubhouse last night note start slow get good bit end get juicy turn table start grill ceo robinhood,0
4676,take day focus people matter life could happier happy father day everyone,0
2990,daily affirmation uh oh oh oh shit oh fuck fuck hell oh hell noooo fuck fuuuck,1
7087,interest guide give concern say willing accept challenge,0
5610,always cost money make,0
7495,want like would post private video piglet puppies frolic basket hold idris elba,0
2222,love life,1
2643,coke sprite coke,1
2714,know live world,1
6004,spoiler alert groom bride whore,0
6818,,0
6945,criticism way adult cry take personally love one continuously criticize never upset reason say whatever issue,0
1837,hate everyone hate,1
1537,loud music cover thought enter mind,1
6464,responsible create lives condition desire must take responsibility think say,0
5900,hello application get ice cream fun know best ice cream spot even pay exchange friendship let know free sometime future thank time,0
1874,today horrible,1
4418,something something hot girl summer,0
4102,,0
3398,oh fuck gf mad food guy food always make well,1
1717,always,1
3670,good,0
4744,imteam best team hope imtow enjoy bootcamp next week,0
1228,,1
5871,left tap westjet amaze company culture devote work together help people solve problem inspire,0
2461,,1
4172,many system suck healthcare system financial system political system etc suck inevitable outcome massive system best system society,0
8231,wear uso tshirt official uniform military supporter say thank arm force get shirt donate theuso today usosupporter,0
7112,pay attention life say last time take stock really go around,0
38,truly feel like everything say always wrong like total disappointment everyone ever let people,1
1678,yep call fat funny,1
4187,get good workout playlist,0
2346,let keep bottled inside healthy,1
8056,audition old spice guy one thing lead another anyway new face old bay seasoning,0
8065,single frame giuliani speak camera look like take doctor office poster title sign stroke,0
7290,easy get lose pandemic fog want provide tool unlearn negative thought focus vision month spiritual spa join live spa thursday march th pm pst pm est,0
6383,god speak u inner voice inner voice never force awareness must invite,0
7826,buy gator three month ago never think would become everydaywear,0
6525,healthy sense worth value people know mean accept others,0
514,hurt like hell know need let go someone ca still wait impossible happen,1
2797,feel slightly obviously die,1
1271,ll never well ll never get good,1
7306,would class thing lot call show fboy archipelago,0
193,tire body tired mind mess really want lay bed never get tired life,1
3700,bitclout time,0
6793,aware handle mind aware treat,0
3590,wo tell question answer,0
3843,double angel invest past month invest past month startups anyone interested startup invest standout company space,0
5853,best hope together anything,0
7405,billionaire actually make great snl host go back watch john rockefeller episode,0
6218,go well miss first stream together tonight pm pst,0
7542,want downer far year feel exactly like last year,0
5115,let something together live conversation infinite game chapter amp special guest today pm youtube linkedin facebook great see ps high five steveshed gif,0
5155,leadership rank position attain leadership service give,0
6172,hey dogdog like complete dog chess amiright see square loser chesscom none tweet age well please jesus one time,0
7324,often get political olympic athlete allow sex describe u,0
4795,cheer imtlol hit gym ca wait root team lcs next weekend,0
488,people need realize day right mood talk interact anyone nothing personal,1
2672,wan na fight war head anymore,1
8248,anyone else keep forget like lentil,0
1011,feel useless,1
8233,announce name year hurricane kanye apple conan,0
5803,someone courage admit know must least reward answer david law,0
4732,ahhhh finish last class bachelor science nursing time pursue esports,0
5014,every day leader deal selfish pressure outside party prioritize short term long term take unbelievable courage choose important urgent,0
1196,belong,1
3281,want elegant scarfbandana tie jauntily neck dirty disposable paper mask use th time broken string,1
6491,new content invest subscribe today get vip daily principle wake iyanla alarm feature amp awakeningsapp iyanla iyanlavanzant actsoffaith fixmylife iyanlaguidance spiritualguidance spiritualcoach awakening,0
5772,company operate environment questionable ethic would feel need advertise ethical,0
4111,ufc back tonight really curious see sport like without fan know nba watch,0
1822,fake smile everyone everyday,1
566,hurt someone heart arm,1
5439,many people confuse rich famous leader wealth fame byproducts qualification lead,0
4356,pokmon type guess mine try guess mutuals back pokmon gt,0
5530,thank everyone buy leader eat last book new york time bestseller grateful humble,0
3631,every podcast get bunch email ask quick call love chat ideas wish people instead take idea pod run email screenshots like kinda people,0
1238,world would better without,1
4297,dress date dismantle police institution design oppress black people perpetuate systemic racism u,0
2214,still hard get get dress,1
660,truly respect people able stay strong even right breakdown,1
4235,cashapp nursebaemax foot pic,0
7645,sure go lose fanatical support supporter know tax wrong,0
3613,another fraudster try scam people shaanvpi please report love god verified twittersupport give check mark people stop get scammed impersonator,0
1050,fuck everything,1
6846,spirit god within pray surrender demand human presence divine,0
6006,lose mizkif twice,0
7057,sometimes need day away fixmylife miss new episode saturday,0
6169,hey chestercheetah sponsor plz,0
6588,let go mean ignore situation let go mean accept without fear resistance struggle control,0
2311,idk anymore,1
4455,grookey look like furby,0
2952,one thing peaceful death,1
988,confuse personality attitude personality attitude depend,1
1767,tire really think,1
3190,give powerpoint presentation reject,1
396,hate get flashback thing want remember feel like heart suddenly drop anxiety start take,1
5059,adopt infinite mindset build stronger innovative amp inspire team career amp life learn apply concept infinite game make life leadership meaningful inspiring amp impactful,0
1104,feel break piece piece,1
603,thing exist body hair acne get sick bad thing happen good people olive,1
5240,difference dog people cat people dog people wish dog people cat people wish cat,0
6541,iyanla read comfortable uncertainty pema chodron take iyanla daily anti viral message day originally air may,0
8094,good news president trump greenland golf course bad news golf cart enjoy one hole conangreenland,0
2573,miss much even realize much hurt,1
5966,yo corinnakopf ask follower write poem wan na read response plz,0
4864,hello baemax personal healthcare provider stream pm cst,0
6917,day receive inspiration holy spirit idea opportunity life way move u along appoint path,0
4000,david might save u,0
7590,like pal sarahksilverman support incredible cause,0
5036,claim understand others really understand,0
5707,leader truly charge inspire others take charge loyalty,0
54,oh ok actually mean heart get rip million piece wo tell care feel anyway,1
7,overthinking ruin ruin situation twist thing around make worry make everything much bad actually,1
5447,mind convinced heart must,0
4726,dhatx arm first business card professional yet,0
5288,judge leader level servitude level privilege army ranger,0
5164,silver lining traumatic time one people live relationship matter call friends ask help offer help get together togetherisbetter listen,0
454,sometimes well keep silent tell others feel hurt know hear understand,1
4464,peanut use rest peanut sleep become healthy,0
3307,compare people really exist,1
4108,committee culdesac idea lure quietly strangle sir barnett cock,0
97,many people world trust issue people say run away soon thing start fall apart,1
722,wish prettier thinner happier friendly less emotional tan confident little less awkward,1
288,ever feel need ask someone actually still want life always feel like really care,1
6557,get daily powerful coach iyanla soothe voice new updated awakening app awakeningsapp iyanla iyanlavanzant actsoffaith fixmylife iyanlaguidance spiritualguidance spiritualcoach dailyguidance awakening positivethinking,0
947,text want conversation piss get day ruin,1
3141,shit come tuesday,1
2981,one struggle one spend time,1
4941,small team commit cause big achieve absolutely anything,0
6263,everything do sorry trick pokimanelol plz forgive queen uwu,0
2367,well find aunt die could day,1
939,hear something absolutely kill act like fine,1
1208,show mean hurt,1
1991,disgrace,1
4086,overestimate year underestimate decade,0
2777,love get attention pretend care get attention,1
1644,say happygolucky person ll never depression good act happy put fake smile,1
398,sad never share deep thought feeling anyone go entire life unspoken nobody understood,1
1062,anyone else find crazy depressed one around notice parent sibling friend teacher classmates one like literally verge tear drown everyone oblivious,1
2028,fuckin depress,1
1939,literally point live lol wish fuckin fail,1
1247,yes hate need remind,1
5442,need life peace die simply remarkable,0
1447,disappear wo waste anyone time money space,1
159,disappointed lot people year believe say one disappointed,1
374,every time put back together watch fall apart every single time worse,1
869,act like care inside care ever think,1
1132,monster sleep bed sleep inside head,1
3394,bf always read currently disclosable information watch aot,1
5417,safe good sidewalk swim pools life require risk get anywhere,0
7747,give canadian little something special year canada dayno american,0
6842,want others speak well u must first think well,0
999,bad battle know feel,1
2599,mom tell go play knife cut,1
6078,wtf,0
6562,divine source recognize acknowledge surrender wo struggle,0
8193,hard tell photo dance spectacular conanghana,0
4121,totally agree try right everyone wrong alert amp act conviction thing others sleep afraid act,0
4157,remittance seem like killer first use case crypto get transfer annually full problem crypto seem able solve happen page factsopinions alekssvetski ariannasimpson vishalharp bendavenport,0
2985,day,1
1692,overthinking every hour every minute every second,1
4904,great company offer u something buy great company offer u something buy,0
5,bad feel something kill inside act like care,1
6008,focused woman run podcasts past year cheer badass bitch many others,0
2093,big fear attempt fail,1
5204,even time like mindset choice let choose focus something positive together read start wan na join start book club join live six week start april rd info,0
7421,ohsnapjbsmoove swears selfhelp guru ever meet hear profound profane thought,0
5732,leader one courage lead u opportunity rush defend u danger ca one,0
7283,way work dishearten must willing try another way,0
2219,hate everything,1
1826,ca see much pain,1
4849,great first stream back beat stick truth bump jenabellafawn aram get noticed nancyyttran senpai ggwp,0
7762,michelle alexander write thoughtprovoking piece nytimes check,0
6748,iyanla read poem earth spiritual literacy frederic brussat mary ann brussat take iyanla daily anti viral message day originally air may,0
2159,wait die,1
3982,trudeau launch roll fund,0
2480,hate know still,1
2703,ask help deal people,1
6117,start end,0
5227,challenge unknown future much exciting story accomplish past,0
372,ever want cry tear come stare blankly space feel heart break million piece,1
5428,leader without title well title without ability lead,0
2120,worthless,1
2824,feel confuse tired grapple confusion strange way relief,1
1112,suck try fuck hard nothing ever seem enough anyone even damn self kl be,1
7322,hey los angeles let ban opentoed shoe indoors,0
2943,feel like everything enough avoid disappointment,1
295,instead tell feel sit twitter post tweet,1
6377,invest subscribe today get vip daily principle wake iyanla alarm feature amp new content awakeningsapp iyanla iyanlavanzant actsoffaith fixmylife iyanlaguidance spiritualguidance spiritualcoach awakening,0
2452,nobody care anymore,1
4328,shop quarantine self care shop quarantine self care shop quarantine self care shop quarantine self care shop quarantine self care shop quarantine self care shop quarantine self,0
6809,truth spiritual principle embrace wholeheartedly eliminate dark negative thought,0
7919,weirdly comfort know realdonaldtrump tweet right come u swiss toilet,0
7742,remember leave tuna fish sandwich desk back march,0
7922,learn madonna inspire catherine ohara accent schittscreek realeugenelevy first moon land late episode podcast,0
2854,someone flirt like distract existential truth mortal aloneness unless ready expand size shape void stay,1
522,hate cry one thing end cry everything mess life,1
3430,love woman,1
7553,anyone feel nostalgic office holiday party yankee candle make great bottomshelf bourbon hotboxed lyft car scent candle,0
331,please understand try best never good enough matter hard try,1
1356,year alone,1
3425,significant worship still,1
6071,minecraft stans advocate wholesome antibullying shit mia sex worker kacey old minx boze attack someone insane,0
3602,talk marclore two day ago start sell amazon start sell walmart buy minnesota timberwolves swear someone remove think small gene guy body,0
6272,go tell kid dad would never lie,0
5938,go live beat twitch streamer good poker lolololololol acrpoker ad,0
8194,pick thing makola market bring home little piece ghana yearold son conanghana,0
1418,constant thought die,1
980,best way avoid disappointment expect anything anyone,1
2075,idk keep try lately feel like die,1
1766,wo ever understand,1
3776,push button rwsb v wall street ll bet internet,0
5924,today special stream annual charity stream honor mom lose year ago raise money alveussanctuary effort raise enough habitat please come hang would mean world,0
5065,show prove show improve,0
2089,remember join twitter mytwitteranniversary,1
653,sometimes wish could read mind wonder could handle truth,1
3952,pdf download time tweet see much juice rt give,0
7180,worth hold ground defend position promote opinion make feel well,0
2359,would die ca,1
8022,new album kanye west say christ often sound like dad try fix toilet,0
5828,truly effective inspire leader driven lead people drive serve,0
7090,find experience loneliness open heart ask spirit divine fill love,0
3756,whitney wolfe hustler behind tinder early growth get harass strip cofounder title leave co create bumble rival version tinder woman take public become billionaire celebrate ipo hold kid win,0
670,like word listen like appearance look simple,1
4659,go haircut today guy,0
350,please expect always good kind love time ll cold thoughtless really hard understand,1
7575,get member basic cable band together perform projectkidscare check semimagic help truly underserved kid,0
3223,yell mirror fault like,1
2064,shit day,1
2711,tell depression emotional progress,1
1007,wonder good enough,1
6016,yo uh desperate time call desperate measure tomorrow egirlrejects chaperon kaceytron justaminx speed date valentine issue one date fill please let know borrow min time please,0
7583,obligate accept post secretary transportation offer,0
4797,share research videogames healthcare see logan super long saturday stream tonight,0
5078,challenge face scare u probably important,0
3702,hubspothustle acquisition nutshell,0
1486,useless worthless depress,1
4957,overcome challenge require courage ask help,0
6671,without boundary people may take advantage set limit expect treat spiritual spa go talk build good boundary register,0
5989,favorite otknetwork stream,0
3759,jeff bezo amazon run year trillion company people employ crazy run funny story early day amazon,0
138,many time type okay cry,1
6210,help man bully son must something slimeisoverparty,0
235,type haha ca even smile act like happy want cry tell everyone okay,1
1063,scar friend,1
7624,drop ballot good luck kanye,0
164,tire tired never good enough tired get put tire cry tired insecurity tire tired,1
4944,love work right privilege responsibility leader cultivate work environment people feel safe inspire fulfil everyone able wake morning say love job,0
6810,best interest give everyone fair share regardless heard,0
3336,case miss selfpromoting,1
3850,wan na see price touch little dangly thing swing backa,0
7908,end impeachment find singer behind mcconnell mask freak,0
949,swear get another dm say see pic spam,1
6245,go live soon play twitchsings kandylul nymnion promise good promise entertain ad live,0
8110,preseason football best time see guy work local petco return punt,0
4154,birthday april th,0
4227,sad hear tespa close door build wonderful community provide many opportunity memory collegiate gamers tespa defined college experience always grateful,0
1134,depression always sometimes hit pm whit friend half way laugh stop,1
6891,powerful divine anything interfere experience expression authentic self must address,0
6077,cat get youtooz,0
2784,silence addict need silence maintain,1
1681,fail,1
703,bother apologize go continue thing say sorry,1
6695,obedient mind speaks listen thought higher call,0
4621,spent day prepare nclex make good luck finally feel ready,0
2803,fine around people five minute less,1
3962,mission change diet start breakfast want find breakfast healthy delicious convienent willing sacrifice take recommendation today attempt egg white spinach pan salsa top,0
7918,one positive side whole impeachment mess get see big cnn make homepage font,0
1490,one cause build wall blame let,1
3661,would better investment coinbase seed round buy bitcoin month answer second video,0
1647,surprised people leave always always,1
2828,cool alone,1
6890,powerful positive reward come forgiveness,0
10,okay okay,1
6650,live best life new updated awakening app get daily powerful coach iyanla soothe voice awakeningsapp iyanla iyanlavanzant fixmylife iyanlaguidance spiritualguidance spiritualcoach dailyguidance dailyprinciples,0
