,tweet,label
2822,forgot life pain remember,1
5675,great company cheer others loss cry win instead focus work make great,0
892,do try want life let know,1
6906,new updated awakening app free download upgrade vip subscription awakeningsapp iyanla iyanlavanzant actsoffaith fixmylife iyanlaguidance spiritualguidance spiritualcoach dailyguidance dailyprinciples liveyourbestlife awakening,0
7214,must learn bend believe break,0
5405,many leadership position talk right true leader actually,0
6179,hey gothamchess hey man long time talk huh know saw chess game today alright know really need chess lesson might fun sometime lol maybe know lol,0
3168,oh great awake,1
3171,always last know everything glad,1
8114,saw hobbes amp shaw idea full name eleanor hobbes mort shaw,0
7755,upside hike face mask degree weather inadvertently create mushroom growhouse,0
7126,experience live grow vitally important aspect spiritual growth,0
3628,kind crazy tweet multiple level,0
6689,midst difficult situation shut open remain open teach next,0
5724,heart go everyone affected blast boston ca believe world live,0
3644,see ya later suzy come next cnbc go want say knew click subscribe,0
6323,know chance know want,0
7533,thank arnold powerful uniquely personal statement hear anyone right country,0
4892,actually go outside today tempohyped graphic,0
6948,heal power spirit within every one u,0
1607,motivation nothing,1
1484,sleep escape reality thought haunt lazy,1
4710,first day work outfit,0
5741,bad leader care right good leader care right,0
7331,week talk spirit educator search masculine cocktail,0
7737,go doctor bmi ice cream,0
7319,like nominate john wilson direct next fast amp furious film,0
3401,want chipotle im work rn,1
695,listen need talk wipe away tear share worry come help face fear,1
6382,fear disapproval fear criticism fear judgment energy power life gift breath god,0
5496,amaze gabi ury daughter get yes author william ury plank good cause let support,0
1923,pain go think,1
4443,somebody help dad buy fuck ambulance midlife crisis,0
4413,baltimore aquarium god name evil sauron eye middle sea urchin,0
4743,sleep seven hour still feel like get hit truck pls send help coffee,0
7070,affirm know power good universe call power forth right perfect every condition life,0
7127,life change moment begin make new commit congruent choice spiritual spa go introduce common dimension choice engage every day,0
4396,expect closely split make happy see really someone everyone,0
4146,steal oatly call marketing division department mind control,0
8037,tom steyer drop race mean still wo billionaire president,0
6440,moment day sometimes week doubt know part spiritual process,0
8049,whether call hotcake pancakes flapjack call shoe wrong thing,0
7174,still shut bless ability stop gain strength move forward,0
4809,ca believe find poke austin like burrito bowl sushi,0
5184,one opportunity life make choice bring life remember submit question part book club bookclub simonsinekcom live pm et tomorrow friday april th,0
4166,podcast awilkinson yesterday say thing still ring head day later,0
2052,pretty sure well alive,1
2889,everything annoy,1
2931,want another person want person,1
7587,instead concede lose trump allow say second term file chapter,0
497,ever notice one notice tear one notice sadness one notice pain notice mistake,1
6848,subscribe today amp get new daily principle wake iyanla voice alarm feature awakeningsapp iyanla iyanlavanzant actsoffaith fixmylife iyanlaguidance spiritualguidance spiritualcoach dailyguidance dailyprinciples awakening,0
7249,often difficult get people follow train thought stop try train,0
43,prefer distance whenever im mad turn heartless person ll ever meet go hate,1
7513,miss retweeted mypillow guy,0
6933,lesson unkind unloving expect something know however learn become responsible live fixmylife,0
2414,mom tell feeling pas year later still hate,1
6297,actually genius,0
7404,sad hear bill gate get divorce know next album gon na good,0
1556,little know care,1
7082,quick way block inflow good begrudge someone else,0
2759,fuck everything,1
6584,life always know exactly need ready prepared receive,0
3443,fuuuuuuuuck,1
1106,feel change even laugh anymore smile talk tire everything,1
4298,lil dog lil backpack brighten day,0
4505,happy starwarsday great sidekick jedi could ask maythethbewithyou,0
839,regret past regret time waste wrong people,1
2707,small talk always bad thing ever happen,1
2269,nobody notice,1
2468,literally ca anymore,1
6551,know deep dark dark side help stand little taller light,0
935,point realize care maybe miss someone,1
5780,skill proacting situation recently remind incredible value learn proact,0
3566,great question could spend hour,0
7597,instead new start ask people develop fun cop mechanism lately,0
2010,hate friend,1
7143,choose live default make victim circumstance,0
3293,okay hot get,1
5791,easy honest tell truth integrity,0
913,people lonely build wall instead bridge,1
1815,suicidal dead numbness pain,1
7877,know la croix actually french croix,0
6702,spend moment listen thought repeat selfaffirming thought weed negative chatter,0
7653,michelleobama zoombombed group whenweallvote volunteer blown away see mrs obama think keith urban sister,0
32,tire body tired mind mess really want lay bed never get tired life,1
689,never underestimate pain person honesty everyone struggle people well hide others,1
5150,new live class land job love join u thursday june th be et pay register,0
2347,hate,1
6365,remain open guide support protected universe open mind heart life,0
2987,ready become well really,1
6181,hey tfblade like gon na get tf play lmao see black white square nerd live pm chesscom,0
8030,house republicans storm show demand part proceeding,0
7237,love foundation universe reason come life reason living,0
2425,addict something take pain away,1
3233,good enough,1
6361,love mean accept strengths weakness work building correct need do,0
1495,know feel like experienced,1
1704,depress thought enter mind one night,1
5399,fear disease hope cure star war clone war se,0
4200,best way wake great night fwends,0
3178,awake minute already much,1
687,care act like,1
2162,nobody talk,1
2450,tell anyway,1
4003,asana amp quora huge take decade start super early facebook guy maybe something early fb culture give ability stay focus single mission toil decade single product,0
7727,bad news googling symptom internet sound like hypochondria,0
2341,hm maybe overdose wo deal anything,1
612,get problem completely make scenario head stress absolutely logical reason,1
3913,billion vc dollar die make display possible,0
2286,extremely depressed,1
3812,anti job requirement zero year experience require college education required beginner prefer,0
2117,really wan na die,1
1796,one day wo around cause pain,1
536,bad news everyone go like good news problem,1
7048,face heal miss final episode fixmylife start tonight owntv,0
6564,beloved celebrate support nurture need anyone else u,0
7435,take ediblea meatball suband happy right,0
5569,new book leader eat last hit shelf jan give one xmas copy available preorder,0
7228,invest subscribe today get vip daily principle wake iyanla alarm feature amp new content awakeningsapp iyanla iyanlavanzant fixmylife iyanlaguidance dailyguidance dailyprinciples liveyourbestlife awakening,0
5032,take time reflect lesson silver lining together make remarkable inspiring year,0
2056,therapy total shit today,1
954,real man man overlook every female attention already one,1
832,sometimes distance care ll notice know stand,1
7690,go break red sox season,0
3440,ready baby baby daddy want keep body choice one carrying baby inside month go hour painful labor kid change entire life prochoice,1
5082,leadership rank position attain leadership service give,0
2422,survive another day,1
7440,theologian believe juda betray christ p,0
8109,may go greenland kick tire deal conangreenland,0
7408,week fan interview call capn crunch mutiny accidentally insult fan pet rabbit sorry momo,0
6527,subscribe today amp get new daily principle wake iyanla voice alarm feature awakeningsapp iyanla iyanlavanzant actsoffaith fixmylife iyanlaguidance spiritualguidance spiritualcoach dailyguidance dailyprinciples awakening,0
3490,grape barbecue popchips think,1
3839,great opp,0
148,ever want cry tear come stare blankly space feel heart break million piece,1
7807,spent minute open closing blind tune camptown race,0
1756,first thing notice everytime,1
5776,bad leader may edit truth fear cause discomfort good leader accept truth often uncomfortable,0
5223,ambition refuse quit leadership refuse quit others,0
5681,customer never love company employee love first,0
5885,rainy day sunny disposition,0
114,hurt much feel become less less important one person truly mean,1
3900,good take airbnb,0
2901,keep make little noise like grnnghgh make sure still alive,1
3376,achievement unlock even depression,1
1462,hurt end hurting around,1
7510,put harriet tubman slippery slope give black woman recognition deserve long time ago,0
2378,mentor officially go today last session fuck upset,1
4262,bad thing road trip across u new place see mf er every mf state wear mask give physical space carry like pandemic,0
1651,anyone need,1
810,stupid enough walk way smart enough let go,1
636,heart never harden temper never tire touch never hurt,1
6371,new improve audio content update available mind matter meditation soothe heal mind iyanla vanzant available io android iyanla iyanlavanzant iyanlameditations mindmattersmeditations fixmylife iyanlafixmylife fearnot,0
7644,honor michelleobama come back podcast special new episode come laugh stay shock revelation want win presidential election,0
7586,worried second lockdown already know best place house cry,0
3382,cry mom problem one make cry,1
7576,kchenoweth kindred spirit incredible performer chapstick addict hear kristin apply chapstick occasionally chat,0
744,confuse personality attitude personality attitude depend,1
6795,put force inner self work good thought produce accord system idea,0
5872,left tap westjet amaze company culture devote work together help people solve problem inspire,0
2954,avoidant attachment style say hi,1
2893,let ignore everything,1
6379,decision power decision force must know choose decide harmony thing know,0
1567,one care anyway,1
1797,girl pretty like look like potato look,1
7879,pretty sure iphone spy start get lot ad water resistant body pillow,0
3786,cross follower drink man say tippity top mountain really half way,0
269,embarrass moment quickly wipe away tear put fake smile hear someone come room,1
7458,lot people complain capitalism without capitalism could threaten knifepoint time square elmo,0
6962,meditation practice bring word action know level soul,0
657,one day go wake realize tried worth fight,1
3227,obsess problem exist,1
5371,follower want take care leader want take care others leader wish,0
1403,everyone talk action something happens,1
4971,people tell brenebrown work anyone else perfect companion work treat talk bren explore debate well whole lot thing listen anywhere get podcasts,0
4742,go see dhatx two week,0
8292,know live different comic book universe love see fight batman neighbor loud stereo,0
3244,ok list lot good shit girlhood melissafebos love amp poems alexdimitrov know officialdonika amp forsythharmon new book also,1
704,waste time give someone second chance someone well wait first,1
5072,leadership journey rise rank leadership journey help around u rise,0
5132,book club one week away next friday july join discus chapter amp infinite game live pm et youtube linkedin facebook send question bookclub simonsinekcom,0
3140,like leave,1
7776,today overslept completely miss nd nap,0
1881,cut friend ask heartless turn around ask leave darkness,1
3093,lonely people,1
2634,big wish go back time watch battle gettysburg,1
4424,show dog pls respond,0
2270,die inside,1
3389,sometimes people depressionanxiety clingy usually make feel something feel numb long please keep mind,1
5073,follower want take care leader want take care others leader wish,0
7206,important share experience people story heal story heal somebody else,0
2930,stage grief,1
3438,weeeelllllll yeah still,1
1890,fall apart,1
3373,ya severely depress least hair pink depression pain lavagirl,1
1179,useless die,1
1602,suicidal thought keep come,1
6342,invest subscribe today get vip daily principle wake iyanla alarm feature amp new content awakeningsapp iyanla iyanlavanzant actsoffaith fixmylife iyanlaguidance spiritualguidance spiritualcoach awakening,0
2026,gon na go back bed wan na awake alive,1
3086,talk eat disorder disorder eating element milk feed polyesterzine rad amp astute hannahrosewens content warn uh whole book basically,1
1069,always ok alone demon come play thrash scream internally outwardly even smile face smile lip scar hips always ok,1
952,never realize lose something good see somebody else enjoy,1
6503,ready admit exactly want experience confusion,0
5522,camouflage oscars eltonjohnparty tuxedo,0
3087,strong independent woman need constant validation stranger,1
4197,almost ready hot girl summer,0
815,fool make mistake hurt learn experience make good person,1
4300,man nickname touchy tyler nobody fuck think tell lmao,0
4687,study buddy,0
936,cry past go stress future arrive,1
5851,trust build tell truth tell people want hear,0
7496,good luck meet anyone tinder executive chair amazon bezos,0
971,nothing hurt disappoint person think would never hurt,1
1067,,1
4244,would die alsjdjdjslshshssks,0
574,something weird thinking single,1
3765,college student want pay loan idea take start make year profit wo get rich ll pay college teach business learn school,0
6755,transformation life long process daily spiritual practice make process peacefull journey,0
4073,amaze note recent podcast episode become idea person,0
3261,wrong clothes body mind,1
266,die dont come grave amp sit tellin much love miss thing need hear alive,1
2486,ca take anymore,1
345,get sad get insecure get jealous get lonely overreact make mistake promise always give loyalty,1
5839,difference beween entrepreneur amp small biz owner small biz owner small business entrepreneurs solve problem,0
875,sometimes feel like wan na sleep forget problem,1
6085,tip help insomnia,0
1154,keep go go crash cry everything anything,1
6612,assist wound person responsibility trust ready heal heal,0
3924,dear pr person dump corporate bad news tonight,0
7843,whitneycummings serious kid become beautiful woman hear conversation,0
7282,iyanla read psalm psalm pray nan merrill take iyanla daily anti viral message day originally air april,0
2116,day clean yesterday throw away relapse yet,1
264,wish someone afraid lose always scar losing people love doubt anyone would fight keep life,1
552,hate forget press send phone sit wait reply like idiot,1
3855,great great thread,0
515,ever feel like abandon everybody thing leave look forward life completely nothing,1
5350,way find work simple,0
7716,true crime podcast idea the husband episode,0
979,sad people know become people know amp use able talk barely look,1
389,feel actually feel pain chest hear something see something really breaks heart,1
2723,understand people like stuff,1
4127,day history internet browse tell iq personality test,0
6983,tonight great story marriage relationship ask right question episode leave fixmylife complete,0
22,hate get sad point body completely shuts lay think problem,1
2514,high key want,1
3675,micro spac run,0
6310,iyanla read sarah young jesus call take iyanla daily anti viral message day originally air july,0
6407,iyanla read spiritual literacy frederic brussat mary ann brussat passage state rise garbage two side existence take iyanla daily anti viral message day,0
2967,want sit quietly father,1
1657,worthless damage ugly,1
797,absent struggle expect present success,1
1048,love song want listen song call jack jill sing aarondoh,1
2914,corporation try give lecture empathy,1
4859,finish last first hour clinical become nurse stream pm cst,0
5646,follower want take care leader want take care others leader,0
2489,,1
1376,lazy scar even breathe,1
5594,link post broken work link new improve discovery course learnwhy,0
5284,find leader inspires u must become leader wish,0
1182,ignore make feel like,1
7635,doctor tell catch virus hugging flag,0
3970,round lead joshbuckley,0
3363,love never speak,1
1914,fuck,1
3669,exceptionally cute idea,0
477,pretend like nothing happen want people see strong know painful emotionaly mentally really,1
1684,might kill kill demon inside,1
6334,live best life new updated awakening app get daily powerful coach iyanla soothe voice awakeningsapp iyanla iyanlavanzant actsoffaith fixmylife iyanlaguidance spiritualguidance spiritualcoach awakening positivethinking,0
4136,call tweet like patfishing fish pat back know everyone gon na say senpai,0
86,worthless feel lock dark room everything say seem piss people,1
984,girl say hate drama chance huge drama queen,1
8296,realize bingewatching child live since born,0
7721,genuinely jealous people live haunt mansion right get company,0
7813,day useless pandemic,0
4994,leader responsible result leader responsible people responsible result,0
8203,dvr u woman soccer game thailand spoiler,0
5314,custom scent illustration amp yes song compose amp perform aloeblacc take listen like,0
6164,chess community want kick tournament toxicity cause call connor baby boy eat trash gon na tell connor actually eat pant sweaty chess virgin fuck big baby boys small dick,0
7277,new updated awakening app free download upgrade vip subscription awakeningsapp iyanla iyanlavanzant fixmylife iyanlaguidance spiritualguidance spiritualcoach dailyguidance dailyprinciples liveyourbestlife awakening positivethinking,0
3698,year ago survivor cast audition,0
5080,inspire see many listen season one bit optimism favorite moment podcast far,0
1211,want disappear,1
8288,webster defines cliche start speech webster defines,0
6686,new improve audio content update available mind matter meditation soothe heal mind iyanla vanzant available io android iyanla iyanlavanzant iyanlameditations mindmattersmeditations fixmylife iyanlafixmylife fearnot,0
6232,make cake super mario,0
4022,get roas deserve,0
6150,need work flirt skill book date kaceytron instead lem know interested,0
5387,goal life life mean something goal life life mean something others,0
8132,include reality trump divorce time,0
4735,might go overboard dh austin place next weekend,0
1367,belong one disagrees,1
3887,sale per minute billion day shopify right amazon want build empire want arm rebel tobi,0
1500,hide easy ll never notice anyway,1
5043,say loud know increase likelihood someone know offer help,0
5866,react email talk people,0
3709,people suddenly become patron art nfts get popular,0
7507,friend zach wood write direct short film star ferrell william jackson harper available watch youtube next day fool check,0
1855,difference want need,1
7625,sorry rashida jones complete engineering meltdown end pony mail,0
2911,forget take antidepressant,1
4936,take care people people take care business,0
480,sad know reason oh plenty reason sure one,1
1184,motivation anything anymore,1
4612,bye austin make gate fly home la,0
1906,wan na alive,1
307,hurt shut turn total bitch shut emotion act differently towards everything everyone hate,1
6439,must patient learn process patient learn lesson remember success many face,0
2594,even still,1
1171,never know handle sadness cry make feel stupid,1
3359,eat alone car,1
7725,fun fact nudity typically blur tv one get genitals sign release form,0
5830,well disappoint truth appease lie,0
5010,charge willing let others take charge,0
8120,get facebook invite storm area anyone else bring potato salad,0
3533,youtube tv change play button random icon nba final for bachelor favorite little design nugget,0
1639,need pity,1
5640,follower vision leader leader without vision follower,0
5381,passion come sell,0
4599,today good day snes preorders lt,0
5188,ready part join book club live start pm et,0
872,stress could chance would would,1
941,speak lot twitter ppl dear unfollowers dont care unfollow dont follow follow unfollow shame,1
4847,first time long time pupper sleep past noon still ready get,0
68,relief sleep sleep sad angry scar hurt lonely nothing,1
588,sad hurt angry mad disappoint know ll put happy face move hurt survive,1
5642,watch one bright young choreographer country emlecrone set new piece that,0
152,hate get close people day always regret share much caring much much feeling much,1
3663,guest thread buying business find business buy finance put less grow sell profit hand mic buddy sievakozinsky living,0
3847,thought whole pay newsletter thing dumb naturally tried experiment result kinda nutty newsletter start bring home per month backstory,0
934,hate someone start tell something end say never mind forget,1
3250,stop apologizing existence,1
2710,heart desire like bad,1
7320,sure stream subscription expensive cable also get remember different password,0
6235,mental illness scapegoat say,0
6359,subscribe today amp get new daily principle wake iyanla voice alarm feature awakeningsapp iyanla iyanlavanzant actsoffaith fixmylife iyanlaguidance spiritualguidance spiritualcoach dailyguidance awakening positivethinking,0
4658,thing make la traffic little easy,0
3416,something wrong left car speaker deadass sound like machine gun bass song ratatatatatatatatatatataa,1
4954,believe already profound impact live people closest ask friend test easy fun way discover core,0
8259,rare honor finally interview great robert caro,0
3788,hack figure someone great work point something wrong get defensive gt go shutdownget quiet gt go quickly recognize truth oh shit yea good point keeper,0
7095,nothing need render please god,0
5131,entrepreneur people thinkthat discuss marketing guru serial entrepreneur sethgodin entrepreneur wife helene learn lot laugh lot really love listen bit optimism,0
7991,perfect phone call guy direct tv,0
1145,game different level deal whit hell different devil,1
4780,clean clothes mom would shame someone roll dirty hairy as,0
6432,purpose life bring soul spirit alignment two energy alignment contact divine self,0
5761,employee take responsibility must first give,0
596,one thing well anyone else,1
4866,fell behind life spontaneous stream today look forward stream together every monday thursday pm cst,0
3361,,1
5790,need remind get pay well show work morning sure sign like job,0
5504,every manager metric opportunity become leader people,0
5515,people often required work minimum standard leader work maximum standard,0
4228,cry club,0
1904,gon na stop take med,1
3476,aha fuck yeah nope bitch,1
2000,consistently suicidal week straight,1
5393,startup company live chat inc tomorrow pm et sign inclivechat,0
4277,need ditto stress ball,0
5834,good belly fire wake drink passion light match get work,0
2444,unhappy age,1
5279,accountability hard blame easy one build trust destroys,0
4499,happy fourth july everyone,0
72,feel change laugh anymore smile talk tire mentally exhaust,1
407,ever feel okay sad time want talk someone hug feel annoy stay quiet,1
4980,average leader give people something work great leader give people something work,0
2734,awake hour time go back sleep,1
4624,happy nationalgirlfriendsday happy many cuties life,0
6284,tomorrow afraid say hi promise bite,0
4627,sex genetic information protect class eeoc sad see people discriminate transrightsarehumanrights,0
4369,time egirl,0
7941,every january st think year break curse witch put hair,0
7235,unfortunately often get caught others tell u fail investigation,0
719,sometimes hate feeling control,1
3313,cool,1
4888,excited bring best esports cosplay dhatx epic video cosplay awesome dotesports,0
6316,alignment desire heart thing way work,0
5025,value learn great share learn,0
918,three type friends life friend reason friend season friend lifetime,1
578,appearance make impression personality make impact,1
6548,know must thing alignment intent fall away,0
42,sad reason bad sad reason absolutely nothing make feel well,1
6193,armada die wish ohssbm,0
2044,idek say wan na fuck,1
591,leader follower unless dark place screw go first,1
7732,turn people predict world end optimist,0
3498,language yet choose speak fact,0
4360,alguien quiere practicar espaol conmigo yo quiero aprender por trabajo lt solamente amigo por favor,0
2936,may miracle passover shine heart forever,1
2564,probably even care,1
3868,check daviddobrik create puzzle puzzle cost st person finish puzzle amp take pic win sell hour hour think hit unit revenue margin profit,0
4383,way support hustormesports local collegiate esports scene hue fest,0
4926,assume lack motivation intrinsic problem leader first evaluate whether create environment inspires employee order spark motivation people must feel see value,0
1748,wait wait nothing good come,1
7999,dear people magazine notice sexy man alive always man sexy switch thanks advance conan brien,0
6794,god help unless allow god help,0
5832,leadership service rank,0
5421,host read party help kid need great concept proud baby si,0
1243,treasure time spend go otherwise take grant,1
7735,really enjoy jimcarrey memoir like jim book wildly comic inventive subversive make primarily compress paper pulp,0
7506,delighted speak one favorite people one fine actor time bryancranston hear conversation,0
5814,throw money perk culture like throw money someone love culture like love take thoughtfulness time,0
3510,wow someone ask elon musk encouraging word people want startup answer need word encouragement startup,0
649,karma come back punch face want case need help,1
7788,absolute blast speaking mike myers canada comedy liverpool anxiety threaten note put office snl,0
5342,great leader may title make great however wear title,0
62,hate get flashback thing want remember feel like heart suddenly drop anxiety start take,1
3137,milf fed,1
