,tweet,label
3845,retirement stop sacrifice today imaginary tomorrow naval spend day want retired quote,0
4685,anyone,0
4881,lucky irl support best flex player overwatch imthyped,0
3348,personal news do grow person,1
1573,go never come back,1
4218,fatigue vaccine sixth hour shift row nooooooo,0
7240,commit one day peace bound feel good want,0
133,bad type cry night everyone asleep control hand mouth make sound,1
3144,help ca stop feeling,1
1072,fake smile much easy explain sad,1
6851,difficult distinguish tell taught,0
7032,beloved thank tune tonight since final season want take every opportunity thank year season support great week fixmylife,0
1386,one want belong worthless,1
3795,could share one private tech company right would onlyfans revenue profitable grow creator year gt grow faster snapchat twitter twitch etc without even app app store,0
1777,care,1
493,amaze fast go good mood really want sleep year damn tire everything,1
4182,ask amp furqanr question everytime new project,0
3150,god grant energy go downstairs eat disgust snack,1
6064,hey nintendoamerica rude please stop,0
3186,get saw,1
7424,ca wait build robot write tweet robot would good everything else robots get appreciation deserve bleep bloop,0
6803,new improve audio content update available mind matter meditation soothe heal mind iyanla vanzant available io android iyanla iyanlavanzant iyanlameditations mindmattersmeditations fixmylife iyanlafixmylife,0
5604,fantastic video true leadership ldavidmarquet one great leadership mind day,0
5619,dr king give dream speech plan speech dreams change course history keepdreaming,0
4461,peanut nominate hug btssmash smashsummit help old man live dream late via smashgg,0
2165,awake nightmare,1
4425,finally make priv show ll show mine,0
7801,sometimes night look star think really get roof house,0
3704,turn cnbc go squawkcnbc squawkalley min,0
278,truly sorry get sad nothing sorry feel everything really sorry screw sorry mess everything,1
2721,amaze katherine go talk frasier finale read poem thank,1
7045,god right right,0
7400,wow look like foremost expert climate change bunch negative nancy,0
6856,surrender release negative toxic unloving thought body accept god beautiful creation,0
8179,learn move beach africa conanghana,0
2584,do,1
2054,able catch break even nightmare think cut,1
1300,bother would see pain,1
4479,happy belated halloween friendly neighborhood cvicu nurse time start get ready thanksgiving christmas,0
234,ever randomly start cry hold emotion pretend happy way long,1
7717,father art heaven hell man,0
6635,iyanla offer affirmation choose let go see thing rightly peace take iyanla daily anti viral message day originally air june,0
2779,sorry ca contemplate cosmic aloneness,1
5191,thank everyone join book club weekend technical glitch show give ask great question watch full record mark calendar part friday april th pm et bookclubwithsimon,0
5062,quit never give try build world see even others ca see listen drum drum one make sweet sound,0
6472,today god day god everything ca god help thing forget say thank,0
7230,trust inner self feel see say,0
6200,cry,0
7024,thankful bet share news final season fixmylife,0
4204,pc setup exam tomorrow,0
1303,deserve pain fault always always,1
4292,quarantine day eat good food support black business social distance remebered put sweatpants,0
298,people suddenly change one day important next day worthless,1
768,accept somebody accept past hold later,1
6623,matter urgent situation may seem thing go happen happen minute sooner,0
7869,due coronavirus group urge ncaa play march madness game empty stadium xfl say hey thing,0
7522,mile sea marianas trench mile bar trump set biden,0
4939,value verbs nouns order build culture envision enact value show every single day,0
5292,ca find leader inspires leader wish,0
4185,,0
1989,wan na able close eye feel alright,1
6570,job earth remind people power create good life well life,0
6814,iyanla offer simple affirmation choose truth extend freedom take iyanla daily anti viral message day originally air may,0
3873,kind expert dog trainer offer pay training help zoom,0
8178,conanghana,0
6456,human being bless power reason time power figure want,0
3466,tryin christmas,1
2819,spoiler existential crisis,1
1319,force word go help make build wall high,1
3323,oh awake,1
1311,ca sleep tired ca,1
5024,occasionally get meet someone whose story absolutely inspire quilen blackwell person path set good grade good college good job decide follow path journey fill difficulty imagine,0
2658,girl,1
2200,decent day would mind hit car,1
6719,beloved what favorite episode one make great impact life tonight learn mine fixmylife,0
2949,love god someone get body,1
5480,leader like parent take responsibility life people new tedtalks today,0
1077,keep say get good change anything worthless,1
5022,true vulnerability post feeling online true vulnerability interpersonal connect favorite definition love give someone power destroy u trust use,0
6424,subscribe today amp get new daily principle wake iyanla voice alarm feature awakeningsapp iyanla iyanlavanzant actsoffaith fixmylife iyanlaguidance spiritualguidance spiritualcoach dailyguidance,0
1342,ignore yet question silent,1
2715,people always like go ok idea,1
6683,matter experience fear lose god know need help already way,0
1868,become like drug make first cut addictive,1
5271,sambranson bvi try help ground short film capture devastation amp hope,0
3192,go studio amp record audiobook milk feed engineer never hear word clit repeat many time also knish anyway avail simonaudio preorder audible google play,1
1147,everyone scar want talk mine body well head,1
3491,cough sneeze tho bad,1
4388,move apartment tomorrow mean setting battle station guy recommend set three monitor pc way visually appeal functional spaceefficient think ll room full ldesk,0
7136,get daily powerful coach iyanla soothe voice new updated awakening app awakeningsapp iyanla iyanlavanzant actsoffaith fixmylife iyanlaguidance spiritualcoach dailyguidance dailyprinciples awakening positivethinking,0
8205,billyeichner join highstakes game crash team race nitrofueled cluelessgamer,0
6012,question please type answer live today pm pst,0
6507,accept acknowledge brilliance stop wait others tell great believe,0
3344,make emotional labor answer,1
5703,believe believe offer blood sweat amp tear believe believe demand money glory,0
7722,disney world run special ticket automatically get fast pas covid,0
6288,mental health minute go take day stream hypochondria flare get river water nose texas ocdanxiety run rampant phone dr therapist er today still relax please send good vibe,0
772,worst feel someone make feel special suddenly leave hang act like dont care,1
6161,hey cizzorz really wan na talk trash today match glhf jk rock,0
6293,community deserve huge thank raise total last night split bcspca little hope memory mom also thank trihex ludwigahgren realmizkif ogrobx host support recently world,0
5798,many company would sooner drop u save number instead drop number save u peoplemakethebusiness,0
6944,many u believe happen u give rise feeling experience truth way around,0
1590,call living dead,1
366,really hate feel see something heart literally sink sit pretend care,1
8112,extraterrestrial living earth hide area,0
1849,sometimes feel pretty notice flaw dy,1
5696,important thing die live,0
7133,ca figure make sense nonsense stop try keep breathing sooner later become clear,0
2844,need worry shit beyond control,1
7839,since stick home thought show make simple repair around house,0
6871,lesson quest perfection often grow internal sense imperfection quest therefore perfect rather prove others imperfect inadequate unworthy fixmylife,0
3754,,0
7080,iyanla affirms able access divine wisdom know everything need know take iyanla daily anti viral message day originally air may,0
5657,shake fold save environment min even need watch whole thing,0
3713,two path become billionaire start world change company marry early stripe employee,0
4498,year old akali first lol champion first cosplay make classic skin pax south hype rework ahhhhhhhhhhhh,0
7157,open learn accept inspire something new,0
145,ever one mood really know whats wrong feel really irritated everyone everything,1
3037,crush people none real,1
1318,numb pain,1
4577,time raise apm,0
4841,wonderful time play ori blind forest tonight thanks much host kers thank everyone hanging,0
5268,take fulfill potential people course write piece guest editor help u work full potential new year richardbranson virgin potential,0
8162,mila kunis special person funny illegal stuff teenager,0
2810,sorry hate everything,1
825,really love someone age distance height weight number,1
7449,call everything bagel come autograph headshot kyle chandler,0
6230,tiktok contest stream today turn amaze thank everyone submit hot egirls need good mod plz follow yetiupnorth win tiktok,0
5756,disconnect device reconnect people funny,0
3129,tomorrow night,1
6170,phrase chess match weak mindset ok happen lose imperfection craft stop get angry lose lose twice always something learn always room improvement never blunder eat cheetos,0
3330,natural state feeling like loser,1
6597,iyanla offer affirmation trust life goodness others take iyanla daily anti viral message day originally air june,0
4220,barbie come lgbtq interracial relationship asian woman excite representation fact barbies make time basically canon,0
5430,team group people work together team group people trust,0
6479,pray meditate exercise stretch take risk pray meditate give thanks every day ll lot well,0
5508,incentive offer prioritize growth stability successfully build large unstable organization,0
4357,think ur bee knee also california celebrate holiday early dec mutuals want hang,0
6114,stream live soon ill bring whisky stare awkwardly eye brain wash sub donate net worth lol jk lmao unless fireballpartner fireballwhisky,0
7706,still available joe biden change mind decides go white woman,0
7786,go hour youtube rabbit hole tip hat father american beekeeping lorenzo langstroth,0
2356,dream give anxiety go bed know ll dream,1
6605,day bless blessing determines bless,0
6413,peace heart mind draw peace life,0
8293,historic experiment democracy great peril april fool pause hello anyone,0
7696,everyone free time hand chance finally get around change name sour cream,0
7430,new meal service recommend soup cannon,0
6043,hey guy really important always want pant minx beat everything please vote heart vote best woman,0
4924,service ornament touchstone,0
1751,ca well something,1
5092,twenty year ago sister family suffer tragedy talk often want talk hope help someone think help lot people be bit optimism,0
3010,look mirror trust,1
2190,care know bother,1
3494,long piss best,1
3451,see black baby isabel,1
2583,ca life normal cry,1
5911,never go another movie quite like princess diary spend lot time mourn idea,0
4414,receive beautiful anatomical heart pendant thinkethereal turn badge reel work cardiovascular icu,0
2595,dare call beautiful,1
3055,never tell fight demon hang,1
760,every one one deep dark secret ca even tell best friend anyone else find entire life would change,1
7396,pandemic really bidet guy one every chair house,0
6989,tonight time heal tune brand new episode fixmylife owntv,0
992,diffrence say,1
3242,oprah like milk feed,1
5239,ultimate value personal growth work feel well contribute around u feel,0
6952,practice forgiveness ticket clarity vitality freedom,0
5715,usairways call lose amp find lax amp amp one ever pick lose agent,0
5331,tell someone outranks u follow someone believe,0
7326,jeff bezos charge someone million minute space sound right owner whole food,0
7967,greta need relax act like kid go play friend glare scorch hell sun,0
1364,point need anyone rather one need,1
30,ever feel physically sick know good enough anyone ca anything right matter hard try,1
3464,annoy,1
7880,ca get fact matter hard try particular tweet go absolutely nowhere,0
5712,progress important perfection,0
7063,invest subscribe today get vip daily principle wake iyanla alarm feature amp new content awakeningsapp iyanla iyanlavanzant fixmylife iyanlaguidance spiritualguidance dailyguidance dailyprinciples awakening,0
3136,milk feed gon na eat,1
6384,daily guide spiritual principle live best life awakening app new content available awakeningsapp iyanla iyanlavanzant actsoffaith fixmylife iyanlaguidance spiritualguidance spiritualcoach dailyguidance awakening,0
207,paradox neither happy sad smile pretty thing laugh funny thing night become mess emotion thought,1
1102,strong everyone think,1
4156,wear work today gold long stand video call,0
395,instead tell feel sit twitter post tweet,1
2928,tonight good febos rule,1
8099,update greenland purchase conangreenland,0
5081,ca choose game ca choose rule choose play new infinite game class help find new way think behave make life career meaningful inspiring impactful,0
7141,iyanla anti viral mssage,0
1052,break think,1
6528,remember acknowledge trust express gratitude god present right,0
5909,get tn post cute beach pic,0
4784,visit celestalon salon yesterday galactic unicorn princess,0
6240,buy keep throw enemy,0
4582,symphony goddess favorite nerd,0
8277,one still elizabeth holmes voice shower,0
4265,stop drive back california chicago il,0
753,honest ask,1
2556,make happy guess good enough oh well,1
4690,happy pride month couple introduce lgbt community,0
2174,thing,1
1004,head currently horrible place,1
6771,well beloved season episode tonight end fixmylife high note real talk thank tuning,0
3806,narrator enough btc,0
7218,freedom unwilling make choice,0
7795,record interview teddanson webcam smudge almond butter either latestage glaucoma hear conversation,0
4158,horse thing budget sport production ever watch wish could hear boo,0
2519,run every possible scenario though head couse anxiety attack worst,1
6349,daily guide spiritual principle live best life awakening app new content available awakeningsapp iyanla iyanlavanzant actsoffaith fixmylife iyanlaguidance spiritualguidance spiritualcoach dailyguidance awakening,0
3173,sad tonight,1
4598,amazing time immortal support calesports collegiate gamers,0
4153,playethic chart,0
1382,want feel anything,1
3147,world like hi sorry still turn,1
8126,get plane week ago one told still wear neck pillow,0
632,life unfair sometimes apologize know right wan na hurt feeling,1
7215,keep good work keep put one foot front take one step time move steady sure pace,0
2232,hate nightmare,1
5404,everything learn parent leadership everything learn leadership wrong bob chapman,0
7970,toast god give terrible bread second chance,0
5236,nice people turn people nice back p opposite also true,0
2300,ll ok,1
5327,strong relationship home work base trust communication communication trust,0
4565,go mph end,0
1481,pretend know,1
3865,year old istitution buy bitcoin dinosaur come,0
3854,gt write gt think gt reread gt reading gt nothing,0
2421,know else say want,1
3458,bill,1
762,prettiest smile hide deep secret prettiest eye cry tear kind heart felt pain,1
2567,fuck hate much,1
6283,fuck wanteppubg meet greet,0
4061,wild young see live must insane,0
3550,one best part kid act amaze tiny thing look bubble act becomes real time curious excite everyday thing,0
3251,remember think knew know,1
8038,heard box adult diaper whisper see real soon,0
559,trust issue people make trustworthy anymore,1
7086,subscribe today amp get new daily principle wake iyanla voice alarm feature amp awakeningsapp iyanla iyanlavanzant fixmylife iyanlaguidance spiritualguidance spiritualcoach dailyguidance dailyprinciples liveyourbestlife awakening,0
2866,oh god fucking future,1
1355,empty feeling stay,1
2861,spoiler nature hat u,1
1920,matter constantly fuck depressed end day,1
1141,fake smile dry eye scratch wrist bruise thigh white pill rope tide gun load suicide,1
3195,kiss like life,1
6450,iyanla offer simple yet powerful affirmation creation take iyanla daily anti viral message day originally air july,0
3941,vcs invest service business undifferentiated business unscalable business hit drive business coincidentally describe vc firm,0
8251,joy talk jimmykimmel career competition late night love feeding people,0
3046,day ll go bed early tonight missy night,1
2610,someone dm please need talk someone,1
6032,best video yet,0
3993,get workout today let slip,0
1968,surgery go really good pain get good time,1
2512,survive another year happy th birthday,1
7837,alexa play something upbeat,0
311,seriously overthink everything make stress creates problem even first place,1
883,force love force leave whoever insist stay one truly love,1
3722,agree,0
5007,weak leader luxury look great leader honor look others,0
5575,well disappoint people truth appease lie,0
7448,wow anyone else leather chap harness feel little tight day,0
2370,hate go bed every night know go wake next morning,1
7547,thank matthewrhys pretend friend one hour pay listen,0
1710,one help,1
3703,cool someone make hotline ask question pod,0
1716,ll still continue smile,1
2668,sad truth,1
2234,someone wan na give reason keep go,1
7434,birthday kid want thing word honor never tiktok dance,0
6376,one anything make anything unless let,0
2327,awful feeling ca even make plan without think suicide,1
5280,goal perfect end goal well today,0
1885,start think suicide way,1
3750,record podcast episode mom last night go post publicly memory really bad thing happens someday convo special highly recommend parent,0
4948,safe good sidewalk swim pools life require risk get anywhere,0
6545,thing god love reason,0
2331,sad sleep,1
2429,fat fat fat fat fat fat fat fat fat,1
651,headphone world,1
6609,new content download awakening app today live best life awakeningsapp iyanla iyanlavanzant actsoffaith fixmylife iyanlaguidance spiritualguidance spiritualcoach dailyguidance liveyourbestlife awakening positivethinking,0
3237,level must actually enjoy imagine bad possible outcome,1
7476,dunkin add avocado toast menu teach snob ihop,0
2601,okay,1
8155,friend andyrichter stop plug new podcast tell filthy story carol channing,0
8051,david letterman reason get whatever hell live hear conversation,0
2578,do word ca even explain,1
355,hate cry one thing end cry everything mess life,1
3075,think suddenly paranoid one likes always paranoid one like,1
1845,hurt many people would better dead,1
7406,people walk emergency room would rather sit probably interesting story,0
1377,ever felt alone might well die,1
7954,season start sentence apostrophe,0
2743,hate connection,1
822,rip everyone fuck play tried lie dead,1
3969,ceo nkla walk away lie way stock market,0
7942,favorite film,0
4403,happy first day school ya gurl officially grad student take ochem,0
1526,always feel like eye ca breathe walk,1
4537,try reset schedule allnighter may overdo coffee,0
4016,fortnite v apple much cooler schoolyard fight signal vs apple,0
7754,miss sensation shake good friend hand find dayold mango pretty similar feel,0
5755,become leader day decide help people grow number,0
6414,worry stagnate mind creates imbalance immune system impairs ability see beyond thing worry,0
3062,want sleep phone want hold,1
978,good heart help much trust much give much love much amp always seem hurt,1
6248,yo twitter tryna end like cuties back,0
4074,awesome way turn tough situation wed cancel awesome moment,0
6808,month spiritual spa go come together talk forgiveness learn recognize area life need forgiveness move away role perpetual victim release register,0
4402,get well sex talk furry twitter asian parent,0
2751,always anniversary dumb shit do,1
4650,happy th birthday best boyfriend americaaaaaa historyteachlol,0
2193,completely worthless,1
6035,one lesson shes already wgm goodluck co coach gmhikaru try get gm pls,0
609,even tweet always scroll judge judge scroll right see everything,1
1167,girl age pretty face scar,1
6982,marriage parentchild motherfather sisterbrother victimoppressor wifehusband really fixmylife,0
2596,,1
7627,father always cast long shadow life mostly thin come sunset,0
581,tweet someone half asleep reading text morning realize make sense,1
2409,wan na,1
7798,honor celebrate collegesigningday michelleobama last year want offer best luck year graduating senior,0
6670,life want good shape good life haggard break broken,0
6431,must willing change give shift perception physical spiritual way living,0
2607,trigger warn last night,1
3301,hi know know exist feel like hate,1
6660,way feed body three time day fee spirit,0
7628,remember last time shock nbc programming decision,0
6253,really wan na funny twitter turn also need funny real life soooo fuck,0
7822,trump son must ask jared also,0
5158,staff sergeant ben brednicki matt macky pararescue jumper u air force sat hope training could help fight front line hospital watch full conversation,0
7622,shit iphone footage selfless act,0
582,sometimes good thing fall apart good thing fall together every story end life every end new beginning,1
616,give fight get go bad time life get best,1
7173,see everyone else high possible regard take iyanla daily anti viral message day originally air april,0
76,prefer distance whenever im mad turn heartless person ll ever meet go hate,1
2014,think need find new therapist,1
663,hard decision decide whether walk away try harder,1
7332,dream day space travel available billionaire person net worth million,0
1522,word say replay mind every night,1
3991,andrew always right damn right one,0
4361,cuff season,0
423,realize lonely end day bunch thing talk one tell,1
5450,difficult get man understand something salary depend understanding upton sinclair,0
7862,doctor tell hug personal contact man get perfect family coronavirus,0
1234,cross road hop car would run,1
7335,fyi end talk show spend time family probably check availability first,0
2123,km gon na realize reach cry help,1
1301,everything shit,1
1560,one care huh guess expect,1
2153,idk still,1
6677,need courage order willing honor divine face human challenge,0
4741,best thing laundry day snuggle warm pile clothes never fold afterwards,0
5870,one good thing hurricane sandy replace much caustic election coverage needabreather adifferentkindofhotair,0
7000,challenge express love daily tell partner love himher daily tell love daily,0
4107,,0
3234,course go relax enjoy life,1
3691,initial reaction bitclout explain second,0
6473,whatever situation find find answer peace peacefilled mind peaceful heart,0
6935,lesson work work fixmylife,0
8077,actor matthew mcconaughey professor university texas mean sometime semester someone gon na get flunked matthew mcconaughey,0
2979,director leave alone,1
467,embarrass moment quickly wipe away tear put fake smile hear someone come room,1
613,one wake stay bed like another hour,1
6148,make among u cake plz like,0
925,music become best friend nobody else understands,1
2809,face reality,1
5440,great leader know total knowledge around vastly great everything know,0
2445,deserve right deserve everything ever happen,1
8294,talk delightful ben stiller redhourben grow show business play michael cohen snl jeff goldblum sexual energy,0
8286,nicolebyer opposite every way love,0
3119,relax think die process,1
1903,wan na med anymore,1
1719,ca concentrate anything right,1
1380,anxiety almost everything,1
5262,come edge say ca afraid respond come edge say ca fall respond come edge say come push flew guillaume apollinaire,0
2774,watch get insecure slow motion,1
7572,biden look new attorney general may do giuliani,0
5991,go live core pm pst love play friend ad,0
7266,live best life new updated awakening app get daily powerful coach iyanla soothe voice awakeningsapp iyanla iyanlavanzant actsoffaith fixmylife iyanlaguidance spiritualguidance spiritualcoach dailyguidance awakening,0
7948,whether say happy hanukkah merry christmas think say see cat movie,0
551,thanks texting first ignore reply,1
930,weird loud random someone want fall love person hide,1
385,sometimes well keep silent tell others feel hurt know hear understand,1
8015,talk great neilyoungnya new album time accidentally attempt guitar solo front,0
1353,tend push everyone life,1
5826,nice stab people,0
4097,short cologne,0
5904,live new game chatplayschess open beta try come challenge game ad,0
2128,wake shitty nightmare,1
3179,call steven spielberg thanks belletristbooks world premiere,1
1299,know gain weight happens thought hit lose motivation,1
7526,great thing xylophone,0
7965,clear lesson boris johnson trump voter like brush hair,0
2289,go bed night know wake go school come home take nap wake find go,1
5357,greatness bear one success greatness born persevere countless fail attempt precede,0
128,tire body tired mind mess really want lay bed never get tired life,1
8012,saw ti hymen trend google,0
6760,life always talk listen life say commit make adjustment need,0
2526,day clean realize good blade felt skin day drain,1
4903,say believe,0
4731,smile dreamhack austin weekend,0
8142,downtown san diego gotham boardshorts conancon,0
3009,always assume totally fucked safe,1
4062,important skill problem solve,0
2105,tire try hard get well,1
2876,house rise anxiety,1
793,come point life realize matter never wo anymore always,1
2379,try cry know would want,1
5637,complain begets complaint anger begets anger optimism begets optimism,0
6060,yo twitch get dmca thegameawards right lol let go together amiright lol fun man guy best love ya,0
2011,feel like annoy everyone hate,1
4,think anyone really understand tire act okay always strong one reality close edge,1
7554,love see blackbeard face told term pirate one day mainly refer aholes steal parcel porch,0
6572,willing take responsibility do do learning challenge grow,0
7351,psa tonight conan finale supersized make sure dvrs set pm tb,0
1585,even belong,1
3581,go period inward learn silence think outward talk teach socialize game changer see many people stick one mode need change mode like weather change season currently inward,0
